username,usertype,score,zan,sc,times,comment,sent_score,sent
水蜜桃儿儿儿,vip,4.5,3,0,2024-03-07 09:50,九寨沟是去年6月中去的，那会应该是枯水季，五彩池很美，但水很少~拍照还是好看的，就景色而言应该还是水多一些好看吧，九寨沟离成都挺远，我们租车开车去的，还在景区内住了一晚（住在树正寨），但个人认为没必要，虽然九寨沟各个点很多，但都大同小异的，静谧的，蓝绿色or绿色的湖泊，有些会有些鱼，看久了会审美疲劳，虽然有观光车但还是要步行很多路噢~，下次有机会，看看其他季节的九寨沟~,0.9999999972750966,好评
潘derder,vip,5.0,1,0,2024-03-06 21:00,冬日九寨别有风情，最关键人还少，门票还买一送一，欣赏风景的体验很好。景区非常成熟，观光车的安排很合理，那个点都有卫生间，而且卫生间很干净，冬天还都有热水，真没想到！老人孩子来也不用特别担心。就是别忘记还是多穿点！,0.9999916610865057,好评
二见倾心,vip,4.5,3,0,2024-03-06 16:47,九寨沟风景区，九寨沟一绝和九寨沟精华之誉，也是九寨沟的骄傲，美不是能用几包话来证明的，要自己亲自去体验和感受；，九寨沟淡季人还是很少的，冬天去体验感是最好的，人最多的还是五彩池；，总体人说还是一般，景区上写着5A旅游地，感觉不值的，所有的水都一样，但是最好的水还是九寨沟的水。,0.9999988809479592,好评
一罐热茶,vip,4.5,6,0,2024-03-06 15:28,说是高速通了一部分 过去只要5个多小时 实际还是开了七八小时 感觉被导航坑了 特别是回程路上下雪结冰 开的更慢了，风景还是不错的 只不过我们去的时候既没有秋天的多彩 也没有冬天的雪景 冷倒是挺冷的 有点遗憾，下回准备等高速完全通了 再来看一次春景或者秋景,0.06493472503189546,差评
嘛哩嘛哩哄,vip,4.0,1,0,2024-03-06 00:00,如果说九寨沟是川西王冠上的明珠，那么五色湖就是九寨沟这颗明珠上最耀眼的那一抹光芒了哈哈~五色湖在景区两条线分叉口不远，如果没有坐到去五色湖的车，可以在分叉路口下车换一辆过去！五色湖基本冬天不冻，但是树是秃的，如果枝繁叶茂相比更加漂亮，湖水真的很美，是唯一让我觉得来回十几个小时的大巴值得的地方。,0.9995037386559757,好评
叶桑稚,vip,5.0,3,0,2024-03-05 18:47,九寨沟是我到现在一直都念念不忘意犹未尽，想念想念想念的景点。，交通：，这里的交通严格说，起来真的不算很好，因为首先我是落地飞机落地的成都，然后从成都坐高铁到镇江关站然后再坐大巴到九寨沟景区，这个中间最起码需要五个小时，从成都到九寨沟第二天呢，一大早就来到景区门口排队，然后跟着观光车去玩玩了一天确实风景真的超级美，现在是淡季哦，原始森林还没有开放，但是里面的景色已经是非常非常美了，不敢想象，忘记的时候有多么的美完了一天要回家了，可是真的很舍不得呀，已经离开九寨沟好几天了，但还是很想念嗯。,1.0,好评
坤坤要早睡,vip,5.0,2,0,2024-03-05 17:03,交通：，我们是自驾来的，所以比较方便，但是景区停车场停满了，只能花钱在外面停。，，顺带提一句景区外的出租车真的需要整顿了，真的乱开价，太猖狂了！，，九寨沟的景色真的不用多说，而且景区里面的体验也很好，观光车安排非常流畅有秩序，而且车上司机也会介绍每个景点的特色，还会教你怎么走会比较好,0.9868776032365258,好评
yinyinguk,vip,5.0,2,0,2024-03-05 14:24,这个时间出行，九寨沟的游客不多，在里面5个小时这样，没有加吃饭时间。坐车加步行，不是很累。三个地区都看到。还是挺不错的。虽然不是夏秋最美的时候，不过没有十全十美，值得来一次。各类钙化的池子。看来九寨不缺钙,0.9999971841079035,好评
小卉0422,vip,4.5,1,0,2024-03-05 11:52,说走就走的旅行✈️，第四站九寨沟景区，九寨沟是我一直想去但是没有去成的地方，这次过来不留遗憾，天气给力即使冬天还有19度的温度使我们这次游玩更舒服了,0.9053160627224136,好评
西伯利亚大王,vip,5.0,1,0,2024-03-05 08:26,上午十点半的高铁🚄到镇江关 ，出站就坐上了免费到松潘的客车 大概一点左右到达松潘 ，买了两点去九寨沟沟口的车票🎫 期间一小时极限打卡松潘古城,0.00020194427719844033,差评
艾瑞斯不梦游,vip,5.0,11,0,2024-03-05 08:04,从成都坐动车来到九寨沟，相比全程开车可以省很多时间，不用早起也不用晚归，到了景区后也会有景区观光大巴，安排非常合理，Y字型从上玩到下。另外说回风景，冬天的九寨沟只要有充足的阳光就会很美，我去的时候正好是大太阳，雪也都化了，美不胜收！,0.9999939323253612,好评
匿名用户,vip,5.0,0,0,2024-03-04 19:35,舟车劳顿，飞机~大巴，历经8小时，终于来到了这里，看到此仙境真是名副其实！九寨归来不看水，不虚此行,0.9965147012718022,好评
好吃嘴儿不要胖嘟嘟,vip,5.0,0,0,2024-03-04 09:47,九寨沟，全球知名景区了，来第N次，还是觉得景色无敌。，，位置， 四川省阿坝州境内，反正位置是距离成都市有点远，但是听说年内就要高铁到川主寺了，那去的话方便很多。，，环境，一级棒，但是走一天耍一天还是累，现在景区里有住宿，在树正寨。，，门票和服务，确实是5A体验，整体感觉可以，一年四季都值得看。,0.9999999863942977,好评
对方正在输入.......,vip,5.0,1,0,2024-03-04 08:45,冬天的九寨沟也是别有一番风味，由于景区特殊的地理环境，山顶还可以看雪，我们去的时候山上也在飘雪，真的跟美。下面也是艳阳高照，蓝色的天空和蓝色的水，特别漂亮！真的是一年四季可以打卡四次的景区。下次一定还会再来！,0.9999997708730216,好评
玲珑骰子yao,普通用户,5.0,2,0,2024-03-03 23:23,九寨沟一个你去了就不会后悔的地方。，九寨沟的美丽不在于秋季也不在于春季，而是在于它独特的冬季。每个季节来都有不一样的感觉，冬的凛冽让你感受这里独特的魅力。,0.9999888109453487,好评
Ruby大寶,vip,5.0,0,0,2024-03-03 20:58,很好玩，就是去的路程比较折腾，也很赶，很多人去，天气会比较冷早上，以为是8点多会开门进来，怎么知道等到了30-40 分钟才开始可以进去，希望可以早点开门，我们早点走完早点赶路回家，哈哈哈哈整体还算不错的,0.7513204229765004,好评
pipichanmao,普通用户,5.0,1,0,2024-03-04 14:59,交通现在方便好多！成都东到镇江关2小时高铁再倒3小时直达大巴到沟口！，酒店也不错，在沟口，早起可以步行到入口。，景区接待分流游客的能力真心,0.9955460764479274,好评
小明同学,vip,5.0,1,0,2024-03-03 09:40,,0.5262327818078083,中评
小张去付钱了,普通用户,5.0,0,0,2024-03-02 19:22,冬天12月底去的，去了之后，下的雪都化了，没赶上最美的冬季，水依旧很蓝，人很少，玩起来很舒服。但是天气不太美丽，景也跟着逊色了一下。去的时候因为是禁火期，原始森林关闭了，好可惜。 往上走，海拔越高，湖水都结冰了，但是不影响观赏，总之，九寨，真的很美，淡季的时候也很值得去,0.9999999937356632,好评
Duang,vip,5.0,1,0,2024-03-02 19:07,元旦节报团去的九寨沟，虽然是淡季，但因为是节假日人还是非常多的。，说说景区的交通吧，里面是有公交车送进去，任何一个景点都可以下车，也可以在站点等车，非常方便。，景色还是非常美丽的，就是感觉时间很匆忙，如果要慢慢欣赏美景可能需要两天时间，如果只是打个卡的话去比较有代表性的景点就可以了。,0.9999560481369381,好评
欣包子,vip,5.0,1,0,2024-03-01 21:32,冬天的❄️九寨，从山底到山顶，各种色彩交叠在一起。，真的很美，冬天有冬天的美。，，而且看着雪很大，但是一点没觉得冷🥶，只穿了一条裤，一路边走边玩，欣赏美景。太舒服了。，，每一个高度都会遇到不同的色彩，太美了。以后有机会秋天要再来一次。,0.9999996646975285,好评
好玩和有趣,vip,5.0,0,0,2024-03-01 20:01,在四川成都报了三日团 九寨沟➕黄龙，第一站就是九寨沟，门票🎫：160，需要逛一天 ，九寨沟山下有很多酒店 建议住这里上山方便，整体的景区是Y型（景点分布见最后一张图），从入园开始就要做景区大巴了🚌 先去日则沟还是则查洼沟 完全随机 ，日则沟好看的景点很多，不管是哪边都是送到最高点 往下逛，小景点之间也有🚌 ，九寨归来不看水，真的一点不假 ，看见了不同颜色的水 完全是大自然的画廊，人间瑶池~九寨沟[萌萌哒R]，这个地方极力推荐 来了四川不可错过的美景,0.9954659318973837,好评
rmmmmmin,vip,4.0,2,0,2024-03-01 10:22,早上九点就去门口排队了，过年真是挤。排一个多小时才进了景区。，进去后又要排队坐车。根本不用挤，别人直接把你推上车。，一定要站在窗子，一路上也有好多风景。，熊猫海还有结冰。熊猫瀑布挺好看。，五花海清澈见底。是一定要下车看的景点。,0.28856879613215514,差评
小桃子,vip,5.0,0,0,2024-03-01 08:50,阿坝藏族自治区 九寨沟风景区 ，具介绍得知～珍珠滩瀑布～海拔2445米，是九寨沟内一个典型的组合景观，也是电视剧《西游记》片尾中，唐僧师徒牵马涉水的地方！，这里真的很美，碧水蓝天，美到用词语无法形容，用相机都记录不完！，非常值得推荐的一个地方，来了 就会爱上！不虚此行！,0.9999921520278492,好评
GG小馋猫,vip,5.0,0,0,2024-03-01 07:12,九寨沟的水果然名不虚传，真的是太美了，不愧为世界水景之王。九寨沟有3条沟，最好看的是日则沟和树正沟，则查洼沟只开了2个景点，其中一个长海景点还冻冰了。走走停停，看看五颜六色的水，有的像蓝宝石有的像绿宝石，有的可以水面倒影，宛如童话中，人生得来一次九寨沟。,0.9999999989285884,好评
廖总统,vip,5.0,0,0,2024-02-29 23:29,没！有！人！能！不！给！好！评！，不愧是5A 几年前夏天来了一次 美死人了！这次冬天来 不同时期不同的美！超级洗眼睛 美死了 而且调度很满意 任何事物都不需要等车因为一直都够 真的很不错！下次还要去一次 流连忘返目不暇接！,0.9999346604261771,好评
葛飞飞飞。。。,vip,5.0,1,0,2024-02-29 20:38,九寨沟太美了！！！很幸运，来成都的前一天从成都南到松潘高铁开通了，去九寨沟的路程时间缩减一半，虽然仍然要五六个小时，但是沿途风景也很不错，在山川间穿梭，领略藏族自治州风土人情。到了九寨沟，整个空气都变得那么清新。水太美了，语言无法形容。随便拍照就对了，因为怎么拍都出片啊。,0.9999997720864953,好评
可乐不加冰,vip,5.0,0,0,2024-02-29 20:29,黄龙和九寨沟去了好几次，每次都感叹大自然造物的出神入化。，图是2015年去的，业余拍摄水平且手机略渣，完全无法呈现真实之美。震撼之余，希望有机会再去体验一把大自然的奇迹。，黄龙和九寨沟海拔较高，容易缺氧，大家要结合自己的身体状况综合评估是否适合前往，如果身体无恙，真的极力推荐！！！,0.9999995871565367,好评
喜乐小洋洋,vip,5.0,0,0,2024-02-29 15:56,春节期间和家人自驾出游，因离家比较近，所以一天可以往返，可能是过节的原因，出游的人特别多，沿途的风景也是美不胜收！，最喜欢的是树正群海，站在海边让人心旷神怡，么有一丝的杂念很清心哦！周边所以的景色都不错,0.9999999305694053,好评
x迪,vip,4.5,0,0,2024-02-29 12:57,交通：，九寨沟交通不算特别的方便，大巴✈️，以及目前高铁，但是最后都是只有🚌才能到。，特色体验：，九寨归来不看水果然名副其实，九寨沟的水每月份都是不一样的，他的水每个池子都是不一样的颜色，最为美丽的是五彩池。虽然长海那个沟就一个五彩池但是一定要去哦。,0.9998988703931929,好评
saragsy,vip,4.5,1,0,2024-02-29 12:39,九寨沟真的很值得大家去看看！过年期间和家人一起去的，冬天说是淡季，门票还有优惠。春节假期人也很多，我们去的时候，有3万多人进入旅游，入门排队排了快一个小时。但是里面的景色好看也是真的好看。各个景点之间有车接送，可以玩一天！拍照也很出片,0.9998571056241286,好评
一条鲑鱼,vip,5.0,0,0,2024-02-29 10:26,冬季的九寨沟，仿佛是一幅静谧的水墨画。尽管少了秋季的五彩斑斓，但冰雪覆盖下的九寨沟更显纯净与神秘。瀑布结冰，形成壮美的冰瀑景观，湖面则如同明镜，倒映着周围的雪山和森林。步行其中，仿佛置身于童话世界。冬季的九寨沟虽然游客较少，但更加宁静，让人能够更深入地体验大自然的魅力。,0.9999999999996518,好评
乌滋乌滋,vip,4.5,0,0,2024-02-29 09:59,九寨沟什么季节都很美而且每个季节还美的不一样，去的时候好多人说冬天没什么好看的，到了之后没有一点不好看的地方，虽然是枯水期有些海子都没水但是还是有很多有水的，而且它加上雪的映衬就更漂亮了，像画一样美的不真实,0.9997462798848048,好评
匿名用户,vip,4.5,0,0,2024-02-29 08:54,据说24年五一后有成都到九寨沟直达高铁，以后就更方便啦。现在是从镇江关坐大巴到九寨沟景区，大巴要坐3小时，还是挺辛苦的。，景色还不错，但是冬季会逊色一些，有的海子水量很小，植物也光秃秃的，吃饭也很方便，景区物价不算贵，在拉格朗日中心吃的一碗面，貌似是30元。不好吃但是也凑合，希望以后有机会 能在九寨沟景色最美的季节 再来一趟,0.9999999686315043,好评
monkey,vip,5.0,0,0,2024-02-29 02:33,瑶池盛景 人间仙境——九寨沟，，雪中的蓝冰 悄然又凝结 ，是这纯洁世界里的荧光童话世界，冬季的九寨沟真的是太美了，每一帧都好美，不愧是第一旅游景点，服务各方面都很好，每个讲解都很棒，景区卫生很干净，景区的餐厅也还行，盒饭20-30不等，太美了九寨沟。,0.9999999999999993,好评
小雯橙子,vip,5.0,1,0,2024-02-29 01:10,交通：，交通便利停车稍远可以住在附近的有免费停车场的酒店，距离差不多还不用给停车费有很多酒店走过去都很近，，特色体验：，每一个季节每一个景点都有它独特的美，拍照超级出片，再有一点点太阳原图直出，，推荐理由：，真的是那一句话5Ａ是景区的上限不是九寨沟的，淡季去人又少服务又好，每个景点还可以坐车,0.9999243079015737,好评
匿名用户,vip,4.5,0,0,2024-02-29 00:05,从成都本地可以报团来九寨沟。虽有购物，但为了这美景，也认了。地势高峻，气候宜人，风景秀丽，以高峰、彩林、翠湖、雪峰、叠瀑、藏情“六绝”而驰名中外，被誉为“童话世界”、“人间仙境”。真的太美了，一年四季都有景。注意高反。,0.999997109276683,好评
Ching,vip,5.0,0,0,2024-02-28 22:18,四川｜九寨沟，，📅2023年1月来的九寨沟，🚌报团，由于当时的高铁还没开通，由成都出发8小时车程！，👉🏻九寨归来不看水。九寨的水是真的无敌，可惜去的时候是下雪❄️天气比较阴沉，看不出究竟这个地方有多美。,0.9990869817360262,好评
林妹男装,vip,5.0,0,0,2024-02-28 20:21,九寨归来不看水，是对九寨沟景色真实的诠释，这是第二次来九寨沟了，真的是四季的美各不相同。现在坐高铁到镇江关，高铁外就有直达的大巴车，也可以坐免费接驳车到松潘再转，整体来说已经很方便了。唯一觉得不好的就是能坐着歇脚的地方太少了，好不容易看到个休息亭却是收费的。,0.8817925879063467,好评
ahuang,vip,4.0,0,0,2024-02-28 18:57,淡季人少也挺好，虽然冬季阴天景色不如其他季节，但可以看雪山雾凇。景色跟喀纳斯比较像，水要比喀纳斯清很多。游览也比较方便，阿坝旅游网公众号上提前买好票，刷身份证进，然后就是坐游览车，哪站停哪站下。除了几个瀑布要走很多路都是台阶上下，其他景点不太走。9点到下午4点出每个点都能走到。吃饭诺日朗餐厅有30块的牦牛面和盒饭，价格不算离谱能吃口热的，味道一般普通食堂水准，牦牛肉很少感觉就是普通牛肉，清汤也是麻麻的味道。，冬季左线比较美，因为海拔高，基本上都是大雪覆盖。，长海：虽然冻住了，但冰雪画面很震撼，五彩池：池水很美，右线因为树木基本上都是枯的，景色一般，箭竹海：很普通，熊猫海：冻住了，五花海：水很透，珍珠滩：要走很多路，是里面最大一个瀑布，冬天水量少像个公园瀑布，镜海：有风无倒影，一般，树正沟这段水比较蓝，风景不错。，诺日朗瀑布：要走很多上下台阶路，冬天水很小，犀牛海、老虎海：都是非常蓝的水，树正瀑布：水小，可以不用往下走，从上面路面上看风景更好，卧龙海、双龙海：水质很好很透亮的感觉，自带闪光效果，芦苇海：要走很多路，可以车上看，冬天风景一般，盆景海：冬天都是枯树，一般，扎如寺：藏式寺庙，有兴趣可以看看,0.9999999999999085,好评
欣芮贝贝,vip,3.0,7,0,2024-02-28 15:28,去年十月国庆假期去的，体验感不怎么好，后悔没有带宝宝推车，大部分走路，而且人多天气也不好，记得很多年前夏季去的时候拍照📷这里好好看，果然自然风景都需要靠阳光☀️滤镜，不过沿途的风景还不错，都需要遇到好天气才行，不过没有去过还是可以去一次，去第二次没有必要，感觉九寨沟的秋天冬天都属于人间仙境，运气好一定选择天气好的时候去,0.9999746707535295,好评
butterfly_8513,普通用户,4.5,0,0,2024-02-28 11:44,九寨沟和黄龙的美，是不用太多说的，也是用不完辞藻的，，交通：，我这次想着重说一哈交通，因为这次去，是我带老人小孩，考虑到自驾一个人开车可能开不下来，就选择了动车到镇江关，然后定的保姆车过去，就是大巴，只不过同排位置是三个，座位前后左右空间大一些，镇江关到九寨沟，车程还需要将近3小时，弯道很多，基本都是当地车牌，我们坐的是当天最后一班动车，6点多到的镇江关，于是基本都是夜里行车到的九寨沟，师傅开车是有点子猛的，车上也没有开空调，我们三个人都晕车很厉害，回程果断包车，走的黄龙再到镇江关，600rmb ，体验感好多了。，，推荐理由：，九寨沟景色真的很美，用“妖娆”形容不为过，只是冬天的黄龙就稍差一点，因为海拔原因，除了最上面的五彩池有水，下面都被雪覆盖了或者干涸的，换个季节来应该会很漂亮。,0.3453314899323028,差评
咕咕咕,vip,5.0,0,0,2024-02-28 10:29,九寨归来不看水。没想到这句话是真的！百闻不如一见啊。真的是见过的最美的水，清澈，颜色多变，蓝色，绿色而且纯度很高！饱和度很高。很像是画里的一样。太美了九寨沟哈哈，下次秋天的时候再来一次，好像每个季节都不同。,0.9999988682051768,好评
南康白起,vip,4.5,3,0,2024-02-28 00:43,九寨沟是中国四川省阿坝藏族羌族自治州的一个著名景区，以其独特的自然风光和丰富的生态环境而闻名。，，九寨沟拥有清澈的湖泊、瀑布群、多彩的森林以及雪山背景，四季变换的风景各有特色，让游客流连忘返。这里还有丰富的生物多样性，包括多种珍稀动植物，为游客提供了难得的生态旅游体验。，，九寨沟的旅游设施相对完善，包括舒适的观光车、清晰的指示牌、便利的休息点等。景区内的餐厅和商店也为游客提供了便利。此外，景区的工作人员通常态度友好，乐于助人。，，总体来说，九寨沟的自然美景和良好的旅游体验使其成为国内外游客向往的地方。不过，由于其地理位置和自然环境的特殊性，游客在前往九寨沟之前需要做好充分的准备，以确保旅行顺利且对环境影响最小。,1.0,好评
Stacie,vip,5.0,2,0,2024-02-27 22:34,如果有什么此生必去的景点，那必然是九寨沟。九寨归来不看水放在国内并无夸张，大大小小的海子形成的一汪蓝碧之水，实在让人沉迷。四季景色不同，能复刷的景区。，景区多年运营管理非常成熟，规范的大巴车很方便，除了进山路途有些辛苦，其他体验都很好,0.9999745965654563,好评
小C爱点dian评ping,普通用户,5.0,0,0,2024-02-27 21:29,来四川这边旅游，九寨沟是必须打卡地一个地方，一年四季有着不同的魅力，虽然无法体验春季的花开但是有机会体验这白雪皑皑的冬天也是很美的一件事情。观光车是必须项目推荐大家买因为来回78公里，而且山路很是崎岖不平，导游说这里是因为地质变化行程的有名的喀斯特地貌，树木参差不齐但是额外茂盛就算是寒冬依然是青绿的颜色，九寨沟有不同的海子，尤其是五彩池就跟镶嵌在祖国地图上的一颗美丽的蓝宝石一样，从不同角度能感觉不同的颜色，九寨归来不看水真的是很有道理。,0.9999994947881253,好评
