username,usertype,score,zan,sc,times,comment,sent_score,sent
huge_girl,vip,5.0,0,0,2024-03-03 14:58,到过九寨沟的人，都会有自己印象里的九姑娘。，，我心目中的九姑娘，身着五彩衣，眼波荡漾，在雪山和蓝天向我们走来。，，九寨沟最负盛名，也最美丽、最沉迷的海子要算五花海。五花海又叫孔雀海，位于孔雀河上游的尽头，据说从老虎嘴俯瞰她的全貌，俨然是一只羽毛丰满的开屏孔雀，那绽开的尾翼如五彩的屏。那一泓碧水嵌在环绕着的山峦之间，坐拥着叠翠的幽谷、皑皑的雪峰、金灿灿的彩林、热情似火的红叶，色彩已经是前所未有的绚烂，被誉为“九寨沟一绝”和“九寨精华”。，，﻿远远望去，九姑娘的湖泊衔接着青山，像是连绵的折叠的画卷，近处的边在我们脚下，远处的边的尽头是雪山和蔚蓝的天。，，去过九寨沟，不看秋。,1.0,好评
豆豆柒,vip,4.0,0,0,2024-02-17 13:35,回老家过年🧨，听九寨沟开通了高铁🚄，临时起意安排一次说走就走的旅行。，在携程上定了酒店和包车服务，包车是高铁站到景区和之间随叫随到，这个还是蛮方便哒！但千万不要买他们推荐的特产，一定会被宰哦！说是自己家的但基本都是拉客性质，价格比市场高出2-3倍。，我们觉得一天时间游玩九寨沟的景区基本购了，因为我们当天游客很多接近3.2万人次，我们8点半到景区已经排起长龙，进入口排了20分钟，但九寨沟容客能力很强，旅游大巴🚌超级快没一会把人都运到了山里，中转站都不停直接开到箭竹海。这一条线真的都是精品，一路下来都是推荐景点，冬天熊猫海有一半是结冰的，只有冬天才会有的美。中午在诺日朗吃好中午饭，下午坐公交车到则查洼沟长海，也是一片冰川拍拍照就需要步行到五彩池坐车，因为冬季五彩池的水很少，不过也很漂亮像一块碧玉。，最后逛正树沟我们都是步行的，带着孩子一路狂走，赶在太阳下山前走完所有景点。，确实看完九寨沟的水，就不想在看其它的了。,0.9999986955607019,好评
healthy6,vip,5.0,0,0,2024-03-06 12:50,2023年11月21日打卡九寨沟。，      大自然鬼斧神工，赐予了九寨沟两大风情—高山与湖泊的集合体。都说九寨归来不看水，但若不是九寨沟周围的山势险奇，也难以烘托出水的风韵。，      五花海的泉水从湖底喷涌而出，阳光照耀下，色彩缤纷，亦真亦幻；诺日朗瀑布，滔滔流水从瀑顶树丛中倾泻而下，像数条洁白的哈达，水势浩大，声振山谷。，      九寨沟的负氧离子有1万多，是北京的几十倍，只要呼吸一口，就让人沉醉。，      一趟九寨之旅，令人窒息，令人陶醉，让人流连忘返。,0.9999961986155906,好评
zjxiann,vip,5.0,0,0,2024-03-01 22:10,交通：，我们抵达成都在成都玩了一天，在纠结报团还是租车自驾，最终选择了后者。不太喜欢跟团赶鸭子式游玩。不过选择自驾也要非常小心，国道开到后面下大雪了，地面结冰容易打滑，不过也是一次非常特别的体验了。，，推荐理由：，虽然九寨沟这时候属于淡季，但是景色有特别的静美，有冰川雪山🏔️有碧绿树林🌲有带有冰柱的瀑布，有调色板般美如画的湖泊。一天像是看遍了四季。淡季人不是特别多，一整天也可以玩的很舒服。另外景区的公交车🚌非常多一班接一般不用硬挤，马上就会有下一班来。公交车上也会有工作人员介绍景点。，，tips：，海拔不是很高，但是最近天气到下午还是会有点冷，里面可以穿上适合排汗的衣服，带上帽子和围巾🧣保暖，手套🧤可以自行选择，我没有戴，全程手机拍照，手套也是无所谓。景区会有工作人员扫雪，但是尽量还是穿防滑的鞋子，偶尔会有一小点点结冰的地方。全程观光车，但是走路也会比较多，穿着舒适为主。，，餐饮：，景区里会有餐厅🍴提供盒饭25-30元左右，也有60元的自助餐（口味一般个人喜好），餐食我不太爱吃，我是猛炫了2碗炖蛋,0.999999429087117,好评
&amp;蜂王酱,vip,4.5,1,0,2024-02-07 08:02,风景九寨沟要比黄龙美很多，几乎不是一个档次，九寨沟还是很值得来也很值得一步步去丈量去记录。，九寨沟路线像个“Y”字，中间一竖和右边的斜是美的风景比较集中的一段。进景区大门后大巴车直接坐到最上面，沿途会有视频播放讲解每个景点的名称和由来。坐到最上面后可以选择步行或部分景点和景点之间坐车，景区内观光车全部免费不算次数。，风景好的没话说，在我心目中“山清水秀”第一名。必须亲临。，景区的开发做得很好。人车分离不担心安全问题，景区内只有大巴没有更多的破坏环境的交通，小卖部。大门口的建筑设计美观具有现代感，也很人性化，还有免费供冷、热水的饮水间。整体在旅游开发这块要做的比黄龙好很多好的。，午饭下午三点才吃，在一个寨子里，目的就是让买藏红花 冬虫夏草牛肉干等东西。贵的没必要。,0.99999999999997,好评
我的天呐,vip,5.0,0,0,2024-03-02 19:14,自驾过来，走的212国道，12道拐名不虚传，进沟赶上下雪了，雪后的九寨沟景色更是美了不少，淡季的票价很优惠，买一赠一，文旅还有200减70的活动，俩人才100多块钱套票，很超值，景区内巴士很方便，想去哪里去哪里，很多人说冬季不适合游九寨沟，其实别有一番滋味，享受雪中的浪漫，散漫的漫步也很不错呢,0.9999999611790644,好评
kentphoenix,vip,5.0,2,0,2024-03-05 21:58,一家人难得的自驾游，从成都租车出发，开了一整天的山路，顺利抵达了九寨沟。去的时候是四月，算是淡季，还遇到了下雪。突然就想起了“人间四月芳菲尽，山寺桃花始盛开”的诗句。因为是淡季，所以人不多，但水确实很漂亮，清澈见底的湖泊洗净了心灵的铅华，湖中的枯树则沉淀了岁月的厚重，让人有种脱离尘世凡嚣之感。相当赞！,0.9999999999983611,好评
sidecar,vip,5.0,2,0,2024-03-13 09:41,天地有大美而不言。，，补一个九寨沟的点评。没想到冬天的九寨沟这么美丽，同时看到了雪景和多彩的海子。天地宽广，心胸也跟着打开。，建议大家在沟里住一晚，藏民家有暖乎乎的牦牛火锅很幸福。或者提前一天晚上到，这样早上进沟玩一天也差不多啦～,0.9999947463201957,好评
Celia菲儿,vip,5.0,2,0,2024-03-13 13:45,九寨沟游览方式:，‼乘坐景区观光车游览，一般景区调度会把游客安排到分叉沟的左手边最高点，或者右手边最高点，两条沟都有可能，具体先去哪条沟看运气。先到右手边日则沟的从第1条开始看，如果先到左手边长海方向的，查阅第6条说明，1、乘车至水景观的最高处箭竹海（再往此分叉沟高海拔原始森林基本无与水有关景点，建议不去），注意‼此景点不走回头路，顺栈道向下步行至箭竹海乘车点（约800m）。注意‼步行至箭竹海上车点涵洞时，先不要过涵洞，先直走100米去箭竹海瀑布拍照，拍照后原路返回再过涵洞到上车点上车。，2、箭竹海上车后乘观光车至熊猫海游览，熊猫海因受地震影响，沙滩和蓝色湖水已经被破坏，建议车上参观，直接乘车前往九寨沟的骄傲五花海，五花海游览建议环湖（约1km），游览时间1小时。，3、五花海环湖结束同样返回下车点上车，乘车前往西游记片尾曲拍摄地珍珠滩和珍珠滩瀑布，注意‼此景点不走回头路，顺栈道先游览珍珠滩，再向下至珍珠滩瀑布游览拍照，一路顺栈道（约1.5km）镜海停车场乘车。，4、在镜海停车场坐上车就等于结束了右分叉沟（日则沟）的游览。，此时观光车会到达三沟交汇处诺日朗中心站，注意‼建议没必要在中心站餐厅吃饭，浪费游览时间，最好自行携带方便食品，游览途中解决！       ，5、诺日朗中心站下车后，直接沿路牌至长海方向乘车点前往左分叉沟（则扎哇沟）游览，乘车时间约半小时，路途18km，最好有座才上！（如找不到长海上车点，直接问小摊贩老板或者景区工作人员），6、若乘车至长海站后下车，长海面积4.8平方km，观景台看全景较为壮观，右侧有楼梯可贴近湖面游览，建议停留时间半小时内！注意‼左分叉沟全程不走回头路。，7、游览完长海背对长海走右手木制栈道，步行约1km前往五彩池，顺路游览完五彩池以后，继续沿栈道步行500m到达五彩池停车场，乘车前往诺日朗中心站方向，左手分叉沟游览结束！，‼注意，按照正常游览时间，此时已是下午，五彩池停车场上车后至诺日朗中心站很可能在中心站不再停车，会直接开往沟口方向，若中心站未停车，只需坐稳前往主干沟（树正沟）！如中途在诺日朗中心站停车，只需沿路牌前往出沟方向坐车！， 8、如要前往诺日朗瀑布游览，必须在诺日朗中心站下车，再步行800米前往该景点，看完后原路返回中心站坐车！‼个人建议诺日朗瀑布可以车上观看，因为一是景点与珍珠滩瀑布类似，二是该瀑布拍不到全景，没必要耗费体力），9、乘车前往出沟方向后，到犀牛海下车，这个景点原地下车原地上车，拍完照后直接坐车前往老虎海。(注意‼主干沟的景点都一定不要过桥到湖对面，不然会错过精华景点)，10、在老虎海下车后，不走回头路，顺流水方向走栈道800米，沿途游览老虎海，树正瀑布，公主海及树正磨坊。‼走到树正磨坊以后请一定不要过桥，走靠山的楼梯往上到达九寨沟的缩影——树正群海。，‼最后到达树正群海后，九寨沟的精华景点就算看完了，可以直接坐车出大门了。下游虽有芦苇海，但观光车中途不停，步行需要3到4公里才能到达下一个乘车点，而且景点性价比不高，所以可以直接坐车出门了。，‼出景区大门之前，观光车上讲解员会问你还有一条扎如沟要不要去，这条沟没有任何与水有关的景点，一定不要去。关键去了过后半天才有车接你出九寨沟，请一定直接出九寨沟景区！,1.0,好评
匿名用户,vip,5.0,0,0,2024-03-20 09:32,我们是上周天从成都过去的，到镇江关站下车后，坐直通九寨沟的大巴车过去，在某程上订票。如果不是旺季，就可以当天早上定下午的票，时间越晚票价越便宜，但也要防止没票了。到沟口附近的酒店住一晚，晚上找了一家汤锅，很不错，服务态度，味道都很好。那个核桃饼很好吃，还又要了一份带走。第二天早上进沟游玩，从检票口坐车上山，那个公交车是到了诺日朗那儿根据调度随机选择一个方向。我是我们运气好，去了景点较多的右边。越往上走，雪越多，一片银装素裹的世界，很童话。虽然看着雪多，其实也不算太冷，正常冬装就行，或者稍微抗冻一点可以穿薄一点，可能拍照更好看。我们时间很紧，当天要回去，所以每个景点几乎就是稍微走了一下就走了。还有几个景点没去，五彩池也错过了，不过这次的遗憾都会成为下次的惊喜与期待，一定会再去一次的。另外，九寨沟冬季实行淡季优惠政策，门票买一送一，多一个人只需要再买观光车的票，我们三个大人一个宝宝，我买了一个买一赠一、一个全票，又刚好有满减，门票观光车票一共才300。我相信夏季水草丰茂，绿水成荫。秋季彩色的树林会更好看。但冬天的九寨也美不胜收，值得一去，就是路上小心点，有雪较滑，工作人员是不能做到完全清雪的，毕竟树上的雪是会掉下来的。,0.9999875934053373,好评
精灵画师,vip,5.0,0,0,2024-03-17 11:07,如果喀纳斯的美是气势磅礴，那九寨沟的美就是灵动秀美。真是此生必打卡的地方,0.9467351137442414,好评
不吃香菜的反派,vip,5.0,0,0,2024-02-26 11:29,💙一直向往的九寨我终于来了,0.9089708341798939,好评
丷Jerry,vip,4.5,2,0,2024-02-07 21:16,❄️❄️❄️雪 九寨沟的冬日美景 如果没有这场雪真不知道能看到什么(っ≧ω≦)っ❄️这趟最喜欢珍珠滩瀑布。86 版西游记取景地。，九寨沟的地形其实很简单，不用看任何攻略，进入景区就是公交车，每个景点都有站。 Y 字中间是诺日朗中心，转车，吃饭，休息，购物都在这里。两边先玩那边都可以。,0.9999947767122219,好评
Kevin,vip,5.0,0,0,2024-03-01 14:05,暴走三万步只为九寨归来不看水，，梯湖叠瀑飞珠溅玉果真名不虚传。找一个好的天气和最亲的人漫步九寨的感觉真的是太美好了，蓝天白云绿水青山，悠然自得犹如置身仙境一般享受大自然带来无穷乐趣.只是景区服务态度需要提高，很多工作人员素质很一般，和这么好的景色相比就略逊一筹了。,0.9999999644679126,好评
你为什么要吃我的饼,普通用户,5.0,0,0,2024-01-16 15:30,冬天的九寨沟虽然没有五颜六色但有着独有的魅力。，冰、霜、雪、雪山、彩虹等尽收眼底，山川湖泊真的像散落在大地上的宝石。，，交通：，🚄高铁现在已经通车了，以前只能跟团或者自驾来，现在可以直接坐高铁来了，方便很多，要不然大巴车要开上一整天。，，特色体验：，牛肉汤锅大家一定要去尝一尝，还有手抓羊排，真的好好吃，青稞饼酥油茶，不一定非要在景区买哈，住的附近转转看看去买就可以。，，推荐理由：，淡季人很少，去哪里都不需要排队，而且冬天的景色完全不输夏天，拍照很出片。，，tips：，保暖！保暖！保暖！然后就是带保温杯，高反那些很少很少，不需要买氧气罐那些，正常人完全可以适应，路上记得带补充体力的食物。,0.9999999999999436,好评
Zxc,vip,5.0,1,0,2024-03-01 08:14,冬日九寨，冰封的童话世界，九寨沟，这个名字早已耳熟能详，但冬天的九寨沟，却仿佛是一个全新的世界，等待我去探索。在冬日的阳光下，我踏入了这片被誉为“人间仙境”的土地，感受着那份独特的宁静与美丽。，九寨沟的冬日，是冰雪的王国。雪花飘落，将整个景区装扮得如诗如画。诺日朗瀑布在寒风中静静地流淌，不再是夏日那般的汹涌澎湃，而是宛如一条银链，轻柔地垂落在山间。在阳光的照射下，瀑布的边缘闪烁着晶莹的光芒，仿佛是大自然的珠宝。，沿着蜿蜒的山路前行，五彩池和五花海在冰雪的映衬下，显得更加五彩斑斓。池水清澈，倒映着周围的雪山和树木，形成了一幅幅绝美的画面。在这里，我仿佛置身于一个冰封的童话世界，每一步都充满了惊喜。，长海是九寨沟最大的海子，它位于则查洼沟的尽头，对面是皑皑雪峰。在冬日里，长海的水面结上了一层薄薄的冰，仿佛是一面巨大的镜子，映照着周围的一切。站在湖边，我感受到了大自然的宏伟与宁静，仿佛整个世界都在这一刻凝固了。，箭竹海是另一个令人难忘的地方。湖畔的箭竹在寒风中摇曳，发出沙沙的声响，仿佛在诉说着冬天的故事。湖水清澈见底，山峦的倒影在水中清晰可见。在这里，我感受到了大自然的和谐与美丽，仿佛自己也融入了这片神奇的土地。，除了这些美丽的自然景观，九寨沟的藏族文化也给我留下了深刻的印象。在游览的过程中，我遇到了许多热情的藏族同胞，他们穿着传统的服饰，用淳朴的微笑迎接着每一位游客。在他们的带领下，我参观了当地的寺庙，了解了藏族的风俗习惯，感受到了这个民族的独特魅力。，总的来说，冬天的九寨沟是一个充满惊喜的世界。在这里，我不仅欣赏到了美丽的自然风光，还感受到了大自然的神奇力量。每一个景点都给我留下了深刻的印象，让我对这个世界充满了敬畏和感激。我相信，在未来的日子里，我还会再次来到这里，继续探索这个美丽的世界。,1.0,好评
Sulimin223,vip,5.0,8,0,2024-01-22 15:21,九寨沟长海看雪❄️，当乘摆渡车去往长海途中，道路两旁银装素裹的树木葱葱掠过，让人流连忘返如痴如醉，拍摄视频的游客忙乎的不亦乐乎。到达长海站刚一下车即被周边的美景惊艳到了，雪山蜿蜒起伏巍峨壮观，海子水如明镜圣洁飘渺，人仿佛置身在仙境之中，相机实难拍出她那震撼而迷人的画面，还是驻足尽情的欣赏吧，将她的美深深的印刻在心里。，感谢大自然赐予我们如此美好的人生邂逅！,0.999999999999998,好评
Cynthia,普通用户,5.0,0,0,2024-02-14 20:42,交通:成都-镇江关（火车12306） 镇江关-九寨沟沟口（大巴各软件搜索九寨沟直通车）  提前买票（三四天），准备物品: 防晒装备 几包感冒药 可能需要晕车药看体质 三千多海拔氧气瓶不太用得上 进沟可以自己准备点水和吃的 景区内也可以买 比外边贵一些 但是能接受 比如罐装可乐里边5元，门票:微信小程序阿坝旅游网/九寨沟景区 买票 160元/人 240元/2人 ，游玩时间: 早上第一波进沟 下午出沟 时间充足，整体体验:景区各项设施比较完善很方便 景区游览车每一个观赏点会停（都有厕所） 到点上下就行 海子都很美 值得去 不建议特种兵行程 感觉不慌不忙看下来不错,0.005361753320862195,差评
小静溜达溜达,普通用户,4.5,0,0,2024-03-15 13:28,3天2晚超详细游玩安排，看这篇就够了，🌟day 1，成都东站➡️镇江关站 （高铁🚄10:30-12:11 💰116），镇江关站➡️松州客运站（免费接驳车🚌发车12:30左右，大约40分钟），松州客运站➡️九寨沟沟口（大巴🚌发车14:00左右，客运站🎫💰42，大约两个小时），	，🌟day 2，全天深度游玩九寨沟景区💰240双人套票，开园时间8:00（附景区地图为最后一张），九寨沟内呈Y字形分布，左边则查洼沟18km，右上日则沟17km，下面树正沟14km，总共49km。，	，上午：景区门口乘车➡️箭竹海➡️熊猫海➡️五花海➡️珍珠滩瀑布➡️镜海，	，中午：诺日朗中心站用餐休息（有个自助餐60/位、盒饭20、烤肉肠10、泡面15、玉米10，吃得性价比不高，,0.9998392374662066,好评
MIMOaiai,vip,4.5,0,0,2024-02-27 16:45,"九寨沟的名副其实是在是太美啦～，十月中旬去完全人不多，机场有直达成都航班，也可以从成都做大巴去，大巴有不同车型，可以选择保姆车可以充电车位距离也大，就是如果开的慢一点大概要十个小时到九寨，时间要预留出一天的行程。但是车票不贵180元的保姆车型。，可以在成都看完熊猫再来九寨，住的希尔顿是没有送机服务的，希尔顿花园不如希尔顿度假酒店，是两家，服务差异很大。自己预订车一般到机场一个人是50的费用，先大概要走一个半小时，从九寨沟景区到黄龙机场，黄龙除了有个德克士是没有吃的的，建议在景区附近或者千里情那里吃完饭再坐飞机。，有的人在黄龙有高反，但是大部分人都没事完全没必要买那些什么红，都是旅行团让你买的，水果也不用，大巴的话沿途会让你各种买水果啥的不用信，九寨的大景区那里商场挺多的都可以买到，还有adidas、nike的专卖店，防风衣都可以买到，在沿途的休息站或者服务站有可能是二手的衣服，要小心点。，推荐进入景区后走Y的左边路线长海那边看长海景区后有五彩池都是大景色，要抓紧时间走哦。下午四点以后大巴车就不往山上走了。二点前可以返回中转站到另外右边的五花海，原始森林，最远处。，中途的大巴都很方便。十月中旬晴天的地方穿裙子，没太阳地方穿羽绒服.,,这里感冒据说二周好不了的，要注意保暖哦。再有需要注意的稍后我再更新哈。#九寨沟旅行 #九寨沟攻略 #九寨沟拍照 #九寨沟住宿 #九寨沟景区直通车 #成都美食 #成都 #藏服写真简影旅拍",0.9873353560921779,好评
幸福lao吃货,vip,5.0,0,0,2024-03-18 09:00,去年的9月份公司团建去了甘南，再从甘南去往九寨沟，晚上住下后第二天一大早去往景区。错峰旅游就是不拥挤啊，九寨沟不愧是得天独厚的风景名胜。随便拍照都出片。每个海子都有自己的特色，下去在夏天一定再来一次住他个十天半个月。,0.2984399512474436,差评
冰栗子.,普通用户,5.0,0,0,2024-03-04 21:07,交通：景区旁边就可以停车🅿️ 我们停了6小时多点35块，整个景区很大 上山下山都非常方便 有公交车🚌接送，每到一个景点都会停车让乘客拍照📷就是去五彩池后 下山的时候有点晕车，特色体验：从每个角度看到了不同的景色，没带身份证可以直接输身份证号码就可以了 很方便哦,0.09132289457426412,差评
chloe522,vip,5.0,0,0,2024-02-07 09:04,我们是在12月底来的川西，路线是上海-成都飞机，然后成都到镇江关高铁，高铁下来包车到了九寨沟，我的评价想分两个部分: 九寨沟景区和九寨沟市，九寨沟市:我觉得酒店密集的区域都是游客区，吃饭的餐厅当地司机也推荐了，巨贵巨难吃。甚至比我们住的橘子水晶酒店都贵。量还少。所以建议大家如果淡季去，吃的实惠就去酒店餐厅吃。正规连锁酒店比较好，一般晚上营业到8.30前后。，九寨沟景区附近吃不到什么好吃的牦牛火锅，就不要想了。，九寨沟景区:管理和景区内班车都很多，很好，景区洗手间也比较干净，好评。，吃的东西不多，只有在三条沟交界处有一个吃东西的地方，大多是泡面。所以大家可以带个自热锅什么的。,0.0007393893702711818,差评
