username,usertype,score,zan,sc,times,comment,sent_score,sent
娟娟_223907,vip,3.5,0,0,2024-01-05 21:48,九寨沟风景区位于四川省阿坝藏族羌族自治州境内，因为沟内有九个藏族村寨而得名。这里被称为世界水景之王，有“九寨归来不看水”的美誉。，坐着观光车一路走来，我就被那迷人的美景深深吸引。公路一旁的山上简直是树的海洋，那参天的杉树，像是紧张的战士屹立在悬崖峭壁之上，一棵棵大樟树撑起一张张绿茵大伞，真壮观啊!公路的另一旁，其实才是九寨沟的最美之处。你看，那碧绿的水面，那欢快的水流，那白花花的水珠，还有那一泻千里的瀑布，就像一幕晶莹剔透的水帘，时而飘落一缕清凉爽快的雨丝。流水浩浩荡荡，穿过石缝，绕过高山，一路欢歌，一路笑语：“丁冬”，“丁冬”，好像音乐家在弹奏，又好像几个小伙伴在嬉戏。，，九寨沟风景区整体布局呈现英文字母“Y”字形。主要有三条游览线路：树正沟、则查洼沟和日则沟。我们先沿着树正沟前行，沿途有很多湖面，火花海、卧龙海、老虎海、箭竹海......它们颜色各异，碧绿、深绿、墨绿、鹅黄;或湛蓝、深蓝、浅蓝，远远望去碧蓝如缎、色墨相间、深不可测。其中给我留下印象最深的还是镜海。当镜海的湖面映入我眼帘的时候，我仿佛就像看到了一位亭亭玉立的少女，稳稳端坐在那里，安静祥和的犹如一位绿衣仙子飘落人间。一阵微风拂过，水面稍稍起了一点涟漪，好像绿衣仙子的飘带在飘荡。此情此景你说像不像在人间仙境呢?，，顺着镜海的山路继续前行，就来到了九寨沟的主要景点珍珠滩瀑布。九寨沟的水没有咆哮，却有欢快和宣泄。欢快流淌的水花向我们昭示了九寨沟的另一番别样的风情。珍珠滩属于高原钙化地形，这里有河水缓缓流淌，钙化地形凹凸不平的表面，激起奔腾不息的水花，恰似一颗颗洒落的珍珠。在珍珠滩的末端，一路欢快流淌的水花，突然间跌入深渊，形成气势磅礴的珍珠滩瀑布。听着缓缓的流水，看着似曾相识的瀑布，忽然间想起电视剧《西游记》的经典画面不就是在这里拍摄的吗?珍珠滩的水花洁白如玉，与九寨沟众多湛蓝的湖水形成颜色不同，风格均异的景象，然而正是这些一路欢快的水花，展现了热情的九寨沟人民的风情。，，九寨沟的美景数不胜数，大自然的鬼斧神工真让人惊叹不已。来吧，朋友!来到九寨沟，来亲自看一看、瞧一瞧，好好地领略一番那美丽如画的九寨沟吧!，游九寨沟的心得体会 篇3，还在我小的时候，就常常听妈妈说九寨沟是多么的美丽，今年夏天，我的好奇心终于被打破了，我和妈妈去了九寨沟。，巴士上，导游告诉我们，水是九寨沟的灵魂，有“九寨归来不看水”之说，今天，我就要亲眼见识九寨沟神奇的风采了。，一到九寨沟，我简直不敢相信自己的眼睛，这是现实吗?分明就是“童话世界”!如梦如幻，如诗如画……，，这里有熊猫海，箭竹海，五花海，镜海，长海……，而唯独让我最难忘的是五花海，它非常酷似孔雀开屏。五花海的水面色彩斑斓，有的浅蓝，有的青绿，有的蓝绿，有的杏黄……五颜六色，美丽极了!水清清的，清得能看见沉积在水底的树木，还有水底一群一群可爱的小鱼。五花海周围的山坡郁郁葱葱，远远望去，就像一片片绿色的海洋，风一吹，碧波荡漾。听说入秋后，山坡便笼罩在一片绚丽的秋色之中，色彩丰富，千姿百态，再加上岸上丛林倒映池中，更加色彩斑斓，五花海也因此而得名，与水下树木、植物点染，五花海显得更加美丽。，，“你牵着马，我挑着担……”相信大家一定很熟悉这首歌吧!没错，这就是电视剧《西游记》的片头曲，而片头曲背景图上的瀑布就是九寨沟的珍珠滩瀑布。，珍珠滩瀑布海拔为2443米，瀑布高21米，是九寨沟内一个典型的组合景观。瀑布被形如新月的岩体分割为数股，或银帘飘飞，或白浪滚滚，或如珠似线，狂奔急泻汇入涧底，喧腾着奔流而下。珍珠滩瀑布宽200米，落差最大可达40米，气势非凡，雄伟壮观，瀑布冲进谷底，吼声如雷，卷起千堆浪花，向东狂奔而去。看着眼前的壮观景象，我流连忘返，乐不思蜀。，，水真是九寨沟的灵魂啊!不同的季节，不同的变幻，它就等着我们去欣赏，去沉醉……，游九寨沟的心得体会 篇4，九寨沟风景美丽，连美不胜收的桂林都败在阵下，是游人必去的好地方。新鲜的空气，五颜六色的湖水 ，是九寨沟的最大特点。，九寨沟的景点非常多，有犀牛海、老虎海、五花海、树正群海、树正瀑布、珍珠滩……如果你不去，就可能会问：这么多海，怎么可能出现在一个地方?其实你想错了。这里人并没有见过海，于是他们就把家乡的湖都称为海。因此，那里有非常多的“海”。，，在九寨沟，我们先看到了“绿遍湖泊”的芦苇海，那成千上万的芦苇把湖泊都给盖住了，根本看不到水。接下来是波光粼粼的火花海，由于太阳把水映出了金色的光芒，水里就好像有火花一样，名字由此得出。再往上就是火花海的上游——老虎海。一说到老虎，大家都会觉得非常威猛吧?其实老虎海平的就象一面镜子，大家都看不出来水在流动，当然你看到下游的瀑布和湍急的河流就知道，水还是流的很快。接下来是犀牛海，这老虎海的上游里隐藏着一个传说：从前，一个高僧骑着犀牛向深山中走去，结果路上生了病，正好到了这片湖旁。这位高僧喝了湖里的水后，病马上就好了。他认为是犀牛帮了大忙，于是将这只犀牛留在此处，这片湖水的名字也就出现了。，，随后我们上了观光车，往最高的景点——原始森林走去。山路弯道非常多，司机又开得非常快，于是观光车成了过山车，飞速向上行驶。到了那里就已经海拔2900多米了，结果一走快就喘，只能慢慢走。在森林里，有许许多多高大的云杉和冷杉，许多小灌木上有青苔，于是整个树上都看起来毛茸茸的。，最后，我实在不行了，只好坐车下到了熊猫海。那碧水蓝天的熊猫海成为了鱼儿的天堂。我们坐车来到了珍珠滩，那里的水又是另一种风格，因为珍珠滩的水多，水流急，所以下面有雄伟的瀑布。我们边走边拍照，来到了当年拍西游记的地方——珍珠滩瀑布，飞流直下的瀑布溅起层层水雾，拍到我们身上。,1.0,好评
超帅的青蛙,普通用户,5.0,0,0,2024-03-20 18:35,天上瑶池，人间九寨。九寨沟绝对不虚其名，九寨沟在冬天是枯水期，但是依旧美不胜收，我们去的时候是淡季，排队的人并不多，可以很好的欣赏美景，5a只是景区的上限，并不是九寨沟的上限。以后还会再来的，下次想看看秋天的九寨沟,0.9997166913121451,好评
郭亦心她爸,vip,5.0,12,0,2024-03-20 06:02,九寨沟国家级自然保护区，位于四川阿坝州九寨沟县漳扎镇境内。，千百年来，九寨沟隐藏在川西北高原的崇山峻岭中，人类的活动显得微不足道。该区藏民几乎与世隔绝，过着自给自足的农牧生活。，这里前几年因为地震，水都差点震没了。，所以想来看的要赶快。,0.9999999956217867,好评
小熙同志,vip,5.0,0,0,2024-03-20 00:15,✔️一天的时间足够游完精华透），四季的九寨沟都呈现不同的景色，可以根据出发时的季节气候调整浏览的景点，例如冬季去长海就结冰了，有人觉得结冰好看有人觉得结冰没意思，具体看自己的情况～，，✔️整个九寨沟的线路呈现 “Y“字型（地图在图2），入景区后会有观光车分别送到三个大站点，具体要根据景区的人流调度安排，，✔️每辆车去到的终点都不一样但观光车上会有讲解员告诉你下一站到哪里，下车之后应该怎么游玩以及应该去哪个上车点上车，这一点我觉得九寨沟景区就做的非常好，每一步都很清晰的告诉你，不会让你在偌大的景区里很迷茫，，✔️需要在景区用餐的可以自行的公众号“九寨沟诺日朗旅游服务中心”自行订餐，如果是淡季去可以到餐厅购买，选择种类会更多画,0.9999999993537831,好评
糖糖lucky11,vip,5.0,0,0,2024-03-19 18:37,九寨归来不看水，这句话不是没有道理的。哪怕是冬天，水少了很多，仍然掩盖不了她独特的美，我们去的时候刚下了雪，长海冻住了，往下走沿途都是雪，连诺日朗都有不少。交通完全不用动脑筋，全程无脑不耗体力游玩，餐厅选择很少，价格不便宜，没有免费热水，自带自热米饭最佳。走走停停5-6小时，算不累，不狂拍的玩法。,0.9998993950072488,好评
hellen47,vip,5.0,1,0,2024-03-19 15:20,都说九寨沟回来不看水，九寨沟的水确实漂亮，不同的景点水的颜色和风景都有些不同。，   景区里面的和公交车一样的景交车非常方便，把我们送到最高景点，再看一个景点就坐车到下一个景点，真心玩的不错，也不累，车也很多，基本都没等多久。,0.9846906606750963,好评
犹太羊,vip,5.0,0,0,2024-03-19 14:09,碧绿的湖水涓涓流淌，来自北方的我从没见过这么美的水，沿途的园区摆渡车免费，而且都有导游讲解下一个将要去的景点特的，与其相关的神话故事，12月份来九寨沟虽然树木有些干枯，但是有好多冰晶也是夏季看不到的，很美，希望有机会夏天再来一次,0.9993811388911558,好评
小莉子靖,vip,5.0,0,0,2024-03-19 11:45,一年四季都很美的九寨沟，这是9月的九寨沟，自驾前往，这是个成熟的景区，周边配套设施齐全，住宿餐饮都不错，一路风景太美了，随手一拍都是美景，中途下雨也不影响他的美，观光车可以到每个景点，不用太累，老年人都可以，不枉此行！,0.9997332868367085,好评
CarpeDiem,vip,5.0,0,0,2024-03-18 19:56,感觉人生能来打卡一次九寨真的就也无憾了，虽然跟着团路途十分折腾，来回成都要花去两天的时间，去之前还赶上滑坡被迫改道前行，但也顺利到达了。看到了非常美的自然景观，每个湖海都是完全不用加滤镜就能拍出来超美的图。虽然去的时候是枯水季，但这种景色看过真的是令人流连忘返。,0.9999993476750856,好评
小小吃货一枚,vip,5.0,0,0,2024-03-17 19:20,神话般的九寨沟美到极致的绝对要属五花海！那如斑斑琥珀的五花海静静地躺在绿色的环抱之中，就像是镶嵌天然翡翠上的一块蓝色宝石。怕三月份过来景色不够美的朋友们，勇敢的冲吧，相信我景色是很美的，非常值得一看，人间胜境！,0.9999999999644711,好评
孙小云,vip,5.0,4,0,2024-03-17 17:54,春节假期后休了个假，带着孩子去逛九寨沟风景区，成都东站坐高铁到镇江关后，从镇江关坐车到松源后再换车到九寨沟，一进入九寨沟风景区，一切路上的疲劳都是为了这美好的一刻，沿着九寨沟风景区的三条游览路线一路游玩，长海、五花海、诺日朗瀑布、五彩池、珍珠滩等等，每一个景点都有它独特魅力。,0.9999779128955534,好评
Ailvin,普通用户,4.5,0,0,2024-03-17 17:01,≠交通#从成都坐约2小时高铁，再转3小时大巴到九寨沟酒店门口下。坐在了最后一排人生第一次坐车坐到呕吐（上次在西安坐一天大巴去黄河也是最后一排，一点事都没）。，，#酒店#新开业的丽呈酒店（五星标准），除了房间小，其它都还可以。主要是位置方便，离景区门口打车起步价。旁边就是美食街，吃饭很方便，味道也很不错。，，#景区#仙竟，冬天去的，遇上大晴天，累色美还不冷,0.9939751113128965,好评
am,vip,5.0,0,0,2024-03-17 09:31,破除重重阻碍，我今年春节终于还是选择了去九寨。九寨最终也没有辜负我的爱,0.9995482407224987,好评
Heather,vip,4.5,0,0,2024-03-16 16:51,错峰打卡九寨沟 冬日的九寨别有一番风味 水依旧很美 山上的积雪也还在 有了另一番景致。九寨沟景区开发很成熟 区内交通很便利 大巴可通到每个景点 基本不需要太走路 但是每个景点其实也不算远 体力好的话也可以步行打卡每个点 途中也有不少好风景。冬天原始森林没有开放 希望后面有机会二刷再来看看不同的景致。,0.9999999880458409,好评
匿名用户,vip,5.0,0,0,2024-03-16 09:10,去九寨沟可以提前在沟口住下来，网购门票及景区交通车票，清晨进沟。景区服务比较成熟，面积较大，景交车上车后随机安排游玩线路，到达最远点再往下接续乘车游玩。随团进去后自己游玩，约定时间出景区，通常下午3时左右。景点主要分布在呈Y型分布的树正沟、则查洼沟、日则沟，高原钙化湖群、瀑群和滩流等水景规模大，形态各异，移步即景，美得令人折服。,0.9988706838037017,好评
土拔鼠1983,vip,4.5,0,0,2024-03-14 22:35,都说九寨归来不看水，能亲自去一趟也是很值得了。门票是真的归，这地方一般跟团去的比较多，早上8点准备去的时候人就已经很多了。景区面积是真的够大，摆渡车票还是要买的。当天没有太阳，如果有阳光景色会更好看。九寨一年四季景色都不一样，还是值得多去几次的,0.9959553802817218,好评
匿名用户,vip,4.5,0,0,2024-03-14 20:45,淡季票价蛮优惠的，景区大巴车基本上不会排队太久。其实对阿坝印象挺好的，不会有宰客的现象，即便有当地人推销东西都蛮便宜的，粑粑柑和玉米都是五元，方便面泡好十块。在镇江关下车还有人推销水，也才两元一瓶，这边人属于比较本分赚钱那种。，九寨沟景区开发的也很不错，首先地方足够大，其次坐景区大巴极为方便，基本上一天能玩完，景色也绝美，对比之下丽江的蓝月谷简直小巫见大巫。唯一有遗憾的是，各个点的景色好像都差不多，蓝色的湖这种，看多了可能会审美疲劳，如果多增加点项目比如漂流，滑雪，划船会更有意思些。,0.9861344355299356,好评
倾城时光,vip,5.0,0,0,2024-03-14 20:29,交通：，报团出行，完全不考虑交通问题，因为我们住在三环外，早上自己打车到集合点的，三环内的伙伴们是可以享受旅游团安排的车接的，这次跟团的导游是张玲小姐姐（整个旅途都很贴心，任何问题第一时间找她，妥妥滴）川ACF115，刘师傅，侯师傅辛苦啦，全程的安全放心的交给他们，特色体验：，对我来说超亮眼的一站是黄龙的五彩池，不愧称之为人间瑶池，附一波美图，强烈推荐大家去身临其境感受一趟,0.9999997509434232,好评
氓,vip,5.0,1,0,2024-03-14 11:28,姐妹们，怪不得说九寨沟是5A景区是因为景区的最高上限是5A，真的名不虚传。超级美，去了直叫人流连忘返。，连夜自驾400多公里去，看到美景的那一刻忘记了所有的疲惫，有些美景真的需要自己亲眼去看才能体会到那种震撼，大家都给我冲,0.9998999228212169,好评
哥本哈根_5888,vip,4.0,1,0,2024-03-13 14:28,避雷划重点：千万不要在周边不收费的地方乱停车，景区停车场收费不低，按小时10元计算，最好停自家酒店区域打车过去，景区内摆渡车班次挺多嘞可以灵活上下。，特色体验：，九寨沟路程呈Y，一般先走景点就到了长海看路程也没继续走了。景区游玩的时间还是有点紧张，尤其是要看芦苇海的，那段路摆渡车不会停下来上客。吃的可以去游客中心简单吃点盒饭或冲方便面，小商铺都有。,0.0019642402538411208,差评
咖啡时间,vip,4.5,3,0,2024-03-13 14:19,交通：，自驾去的，景区停车场收费不低，按小时10元计算，但是奉劝各位千万不要在周边乱停乱放后果很严重！最好停自家酒店区域打车过去，景区内摆渡车班次挺多嘞可以灵活上下。，特色体验：，九寨沟路程呈Y，我们因为在途中看上好看的藏服旅拍耽误了一个多小时，部分景点就没去了最远只到图2的长海。早上十点多进景区，四点过出来的，为了看图1芦苇海走惨了……看个人取舍吧，个人还是比较推荐小姐姐尝试下照片我们讲了好了价，现场拍完就把拍原照传给你没有P图,0.3094266187859941,差评
那只猫,普通用户,5.0,1,0,2024-03-13 13:47,早上九点入院，我们玩了三个多小时，不必要全部都去，网上找的路线，箭竹海，熊猫海，五花海，镜海，去看看就行了，其余的地方没什么意思，池子都一样，这几个地方看完了其余的就不想去了，长海上冻呢，山上冻上了，山下还行，池子就是这四个地方拍的，没滤镜，挺好的，,0.9908486857977364,好评
喜开颜笑小怪兽,普通用户,3.5,0,0,2024-03-13 08:45,交通:，很方便，交通直达，就是太远了，得看一个地方就坐车去另一个地方，太大了，特色体验:，风景真的很美，三月初去的还是雪山，很有一番风味，还是原相机，推荐理由:没去过真的可以去看看，很惊艳，交通也很方便，推荐前往，对了，要有阳光的时候去，太美了,0.9999997419812705,好评
二花脸,vip,5.0,3,0,2024-03-12 18:12,,0.5262327818078083,中评
美好生活,vip,4.5,0,0,2024-03-11 19:03,九寨沟，这个美丽的名字背后藏着怎样的自然奇观和人文魅力呢？今天，就让我们一起走进九寨沟，感受它的独特魅力！，，九寨沟以高原钙华湖群、钙华瀑群和钙华滩流等水景为主体，其水景规模巨，景型多，数量众，形态美，表局精和环境佳，是九寨沟景观的精华。，九寨沟是一个充满自然魅力和人文底蕴的地方，它的美丽不仅仅在于山水之间，更在于人与自然的和谐共生。如果你还没有来过九寨沟，那么一定要来一次，感受它的独特魅力！,1.0,好评
匿名用户,vip,0.5,0,0,2024-03-11 16:56,九寨沟的关门时间是下午5点，从3点多开始，下山的观光车几乎都不停，站点全都快速开过去，4辆里面有1辆会停的概率，游客拼命招手都不搭理，越是游客挥手示意，那些司机开的越快，明明是站点凭什么不停？就造成只要有一辆车停下，就被塞得满满的，所以人挤得要死，(夸赞这类司机，知道只要停下就是塞满车厢，却还履行职责，造成这种情况是那些**失职的司机)，本来游客玩了一上午，下山就很累了，而且游客已经买过观光车的车票了，凭什么上山就乐乐呵呵地拉上去，下山就当甩手掌柜，我下山的时候，那一车游客都挤的吐槽，明明付过观光车的费用了，还这样，体验感很不好,3.938385617630047e-09,差评
风尘散人,vip,5.0,2,0,2024-03-11 10:00,交通可以乘坐班车，成都茶店子，新南门车站直接购买到九寨沟的班次，也可以自驾。，九寨沟呈现Y字型，景区里面有班车，景区很大，可以选择有代表性的景点。，有代表性的就是珍珠滩瀑布，是86年版西游记的取景地。还比较推荐，五花海，诺日朗瀑布。，景区的物价还算合理，泡面十元，提供热水，还有盒饭30。,0.99999981447443,好评
吴大亏旧号上不去,vip,4.5,0,0,2024-03-10 18:30,📍导航精准。能自驾可以慢慢自驾。,0.9251016266522623,好评
dingqun1979,vip,5.0,1,0,2024-03-10 17:18,九寨归来不看水，的确美得不可方物。，淡季来，门票买一送一，很值得！，九寨沟是Y字型，三条沟，进入景区有游览车送到y字左边或者右边最高处，然后一路向下，根据景点走路或者游览车接驳，到了三沟交汇处可以吃饭，有自助餐盒饭或者点菜，价格和味道还是可以接受。吃完饭游玩y字另一边，结束后回到日诺朗中心，游玩最后一条沟，也是出口方向。我们是早上8:30分到下午4:30出，时间很充裕，一天完全可以。，总之很精彩的一天，可以说每一抹蓝都在治愈我的双眼,0.9984387783833858,好评
小花生,vip,5.0,0,0,2024-03-10 10:41,🌈九寨沟，大自然的奇迹！,0.9860960893623294,好评
火锅妹,vip,5.0,0,0,2024-03-09 19:09,九寨沟位于四川省北部阿坝藏族羌族自治州九寨沟县，是一片风景秀丽、自然神秘的地方，被誉为“人间仙境”。，九寨沟以其七彩缤纷的湖泊和瀑布群、原始森林、童话般的林间小物和民族风情，吸引了世界各地游客前来观光，被列为世界自然遗产、世界生物圈保护区，同时也是国家AAAAA级景区。，九寨沟的独特之处在于其地貌特征，因地处青藏高原与四川盆地的交汇处，地质构造完整，地形地貌呈现了海拔高度、崇山峻岭、冰川雪峰、峡谷溪流以及各式各样的湖泊与瀑布,0.999999999999986,好评
小米奔騰至尊會員,普通用户,4.0,0,0,2024-03-09 05:25,交通：，跟团来的，里面的观光车还是比较方便的。，特色体验：，第二次来九寨沟了，第一次是10年前了，没有第一次感觉那么惊艳，这次还有冰雪没有融化，但是不影响美感。，推荐理由：，山美水美，里面餐饮也方便。，tips：，大家注意，这里面食堂，盒饭25，30的就可以。买东西一定要讲价，手串10元。,0.9994214342134008,好评
好多级,vip,4.0,0,0,2024-03-08 10:55,九寨沟简直是太美了，整个景区呈Y字型，进入景区之后还是要乘坐景区巴士的，依山而建，池水清澈见底，天气晴朗的话看得到山水湖光一色，山景印在水中，两两相得益彰，相互映衬。里面有拍照的当然也有做妆照的，想要留下美美的照片，那是不能错过哦。由于是在山上的景区，空气清新，并且略微的湿润，感觉给肺洗了个澡，很是舒适哦。PS：景区门票价格不便宜，如果抱有过多期待的话可能会失望哦，主要是爬山+看池水哦,0.9999881837224629,好评
小峰峰,vip,5.0,5,0,2024-03-08 10:44,九寨沟位于九寨沟县漳扎镇九寨沟风景区，坐大巴从市区到九寨沟真的很远，但是九寨沟真的很值，九寨沟的风景真的很美，奔腾的河水，清澈的湖泊，翠绿的森林，仿佛是大自然赋予这里的最美的礼物，天上瑶池，人间九寨。果然名不虚传，真的很棒,0.9999999999999991,好评
只是昨天,vip,4.5,0,0,2024-03-08 08:25,九寨沟是我最喜欢的景区了吧，十多年前就去过两次了，一次是秋天，一次是冬天。今年春节突然刷到了九寨沟的帖子，临时起意来了一次说走就走的旅行，有车了真方便啊，走的汶川阿坝方向这条线，一路开了七个小时到了沟口，现在已经跟十年前完全不同了，人真的好多，沟口热闹非凡，极其拥堵，因为临时决定来没有订房间，结果附近四五公里内都没房间了，好不容易找到个离沟口十几公里的客栈才住下了，没热水没空调，电热毯也是坏的，将就了一夜。第二天进沟堵了一个小时，到门口排队半个小时验票，排20分钟坐上观光车，如今不像从前那么方便了，坐观光车也不知道会到哪个点，都是服从调度，不像从前，可以自己选择在哪个点下，还可以选择步行，现在很多地方被封住不准步行，只能坐观光车，按规划路线走，有些小路上的风景就看不到了，总的来说体验感再也没有以前好，觉得景色也没有以前美了,0.9999944748952447,好评
颖颖美黛紫,vip,5.0,4,0,2024-03-08 00:19,规划已久并且十分期待的行程。，秋季的九寨彩林闻名遐迩，据说最佳时机是10/20-25这段时间，因为工作原因，11月初才有时间。也算是赶上了彩林的小尾巴～，，交通：，在飞,0.9991230646899786,好评
淀粉炒蜜汁,普通用户,4.5,1,0,2024-03-07 21:23,交通 我们跟团来的这边 还算方便 就是时间有点久 九寨沟景区内 观光车很方便 住宿环境也还好 考虑到室内冷 酒店有电褥子 景区内环境也挺干净的 每见到水 都是震撼的 蓝蓝绿绿的 所有的照片都不及眼睛见到的美 旅游无非就是从自己呆够的地方去看看别人呆够的地方 无非就是溜达 看景色 心旷神怡 还不错的 跟团也很省心,0.999986547174111,好评
